{
  "prospect": { "name": "Acme Rockets", "short": "Acme", "domain": "acmerockets.com" },
  "title": "Acme Telemetry Inspector",
  "tagline": "Made for Acme Rockets by PostHog",
  "palette": { "primary": "#e0402a", "secondary": "#1c2a4a", "accent": "#f7c948" },
  "products": ["session_replay", "error_tracking", "feature_flags", "experiments", "product_analytics"],
  "music": { "mood": "focused, mission control hum, countdown tension", "bpm": 118 },
  "text": {
    "win": "Five launches, zero bad telemetry. Mission Control finally trusts the dashboards.",
    "lose": "Bad telemetry reached the launch review. Scrub, refuel, and inspect again.",
    "credits": "Made for the Acme Rockets crew by PostHog"
  },
  "game": {
    "difficulty": "hard",
    "desk": { "name": "Mission Control Data Desk", "sprite_prompt": "a dark grey control-room desk with small glowing buttons, seen from above" },
    "manager": { "name": "Flight Lead", "title": "Launch Director", "sprite_prompt": "a calm launch director with a headset and a navy flight jacket" },
    "sources": ["web", "ground_stn", "api", "sat_link"],
    "events": [
      { "name": "launch_scheduled", "props": [
        { "name": "pad", "values": ["39A", "40", "SLC-4E"] },
        { "name": "payload_kg", "values": ["120", "450", "900", "1500"] } ] },
      { "name": "telemetry_viewed", "props": [
        { "name": "satellite_id", "values": ["ACM-7", "ACM-12", "ACM-19"] },
        { "name": "view", "values": ["orbit", "power", "thermal"] } ] },
      { "name": "deploy_shipped", "props": [
        { "name": "env", "values": ["prod", "canary"] },
        { "name": "tests_passed", "values": ["true", "false"] } ] },
      { "name": "anomaly_reported", "props": [
        { "name": "severity", "values": ["low", "medium", "high"] } ] }
    ],
    "personas": [
      { "name": "Priya", "role": "Satellite operator", "sprite_prompt": "a satellite operator with a black ponytail and a red mission patch jacket" },
      { "name": "Tom", "role": "Ground engineer", "sprite_prompt": "a ground engineer with a beard, safety goggles on his head and an orange vest" },
      { "name": "Lena", "role": "Mission planner", "sprite_prompt": "a mission planner with short silver hair and round glasses" },
      { "name": "Omar", "role": "Payload customer", "sprite_prompt": "a payload customer with curly hair, a smile and a blue suit" }
    ],
    "days": [
      { "intro": "Welcome to Mission Control! Only events from the tracking plan get into the launch dashboards.",
        "rules": [ { "type": "unknown_event", "text": "Flag events that aren't in the tracking plan" } ] },
      { "intro": "The test rig is leaking into prod telemetry again. Keep simulator traffic out.",
        "rules": [ { "type": "blocked_source", "text": "Flag events from the simulator or staging", "values": ["simulator", "staging"] } ] },
      { "intro": "Our own engineers keep poking the live dashboards. Their clicks aren't real customers.",
        "rules": [ { "type": "internal_user", "text": "Flag events from @acmerockets.com emails" },
                   { "type": "required_property", "text": "Every launch needs its pad", "property": "pad" } ] },
      { "intro": "Somebody scheduled a 90-ton payload on a smallsat rocket. Check the numbers.",
        "rules": [ { "type": "value_in_range", "text": "payload_kg must be between 1 and 2000", "property": "payload_kg", "min": 1, "max": 2000 },
                   { "type": "future_timestamp", "text": "Flag events stamped in the future" } ] },
      { "intro": "Launch review tomorrow. No untested deploys counted, and no double counting!",
        "rules": [ { "type": "property_equals", "text": "Flag deploys where tests_passed is false", "property": "tests_passed", "value": "false" },
                   { "type": "duplicate_id", "text": "Flag IDs you've already seen today" } ] }
    ],
    "final_record": { "intro": "T-minus one record. It came straight from the launch pad. Check it twice." }
  }
}
