{
  "prospect": { "name": "Your Company", "short": "You", "domain": "yourcompany.com" },
  "title": "Data Inspector",
  "tagline": "A tiny game about clean data, by PostHog",
  "palette": { "primary": "#f54e00", "secondary": "#1d1f27", "accent": "#f9bd2b" },
  "products": ["session_replay", "product_analytics", "feature_flags", "error_tracking", "surveys", "experiments"],
  "music": { "mood": "calm, focused, ticking clock, office bureaucracy", "bpm": 112 },
  "text": {
    "win": "Five days, zero garbage. The dashboards finally tell the truth.",
    "lose": "Bad data slipped into the dashboards. Nobody trusts the numbers now. Try again?",
    "credits": "Made with PostHog. Music and art generated locally."
  },
  "game": {
    "difficulty": "normal",
    "desk": { "name": "The Data Desk", "sprite_prompt": "a warm wooden desk top with faint grain, seen from above" },
    "manager": { "name": "Morgan", "title": "Head of Data", "sprite_prompt": "a cheerful blonde data lead with glasses and a red tie" },
    "sources": ["web", "ios", "android", "server"],
    "events": [
      { "name": "signed_up", "props": [
        { "name": "plan", "values": ["free", "pro", "team"] },
        { "name": "referrer", "values": ["google", "twitter", "newsletter", "direct"] } ] },
      { "name": "invoice_paid", "props": [
        { "name": "amount_usd", "values": ["49", "99", "499", "1200"] },
        { "name": "plan", "values": ["pro", "team"] } ] },
      { "name": "page_viewed", "props": [
        { "name": "path", "values": ["/", "/pricing", "/docs", "/blog"] } ] },
      { "name": "feature_used", "props": [
        { "name": "feature", "values": ["export", "dashboards", "alerts", "sharing"] },
        { "name": "count", "values": ["1", "3", "12"] } ] }
    ],
    "personas": [
      { "name": "Sam", "role": "Busy founder", "sprite_prompt": "a smiling founder with short brown hair and an orange hoodie" },
      { "name": "Rosa", "role": "Power user", "sprite_prompt": "a woman with long red hair and a yellow sweater" },
      { "name": "Kai", "role": "Developer", "sprite_prompt": "a developer with curly black hair, glasses and a blue t-shirt" },
      { "name": "Ada", "role": "Finance lead", "sprite_prompt": "an older woman with a grey bun, glasses and a green blouse" }
    ],
    "days": [
      { "intro": "Welcome aboard! Only let in events from our tracking plan. Typos break every dashboard.",
        "rules": [ { "type": "unknown_event", "text": "Flag events that aren't in the tracking plan" } ] },
      { "intro": "Someone left staging pointed at production again. Keep test traffic out.",
        "rules": [ { "type": "blocked_source", "text": "Flag events from staging or localhost", "values": ["staging", "localhost"] } ] },
      { "intro": "Our own team keeps clicking around in prod. Their events skew everything.",
        "rules": [ { "type": "internal_user", "text": "Flag events from our own team's emails" },
                   { "type": "required_property", "text": "Every event with a plan must have its plan", "property": "plan" } ] },
      { "intro": "Finance says revenue looks weird. Watch the invoice amounts and the clocks.",
        "rules": [ { "type": "value_in_range", "text": "amount_usd must be between 1 and 5000", "property": "amount_usd", "min": 1, "max": 5000 },
                   { "type": "future_timestamp", "text": "Flag events stamped in the future" } ] },
      { "intro": "Last day before the board meeting. Plans must be real, and no double counting!",
        "rules": [ { "type": "property_in_set", "text": "plan must be free, pro or team", "property": "plan", "values": ["free", "pro", "team"] },
                   { "type": "duplicate_id", "text": "Flag IDs you've already seen today" } ] }
    ],
    "final_record": { "intro": "One last record before the board meeting. It looks fine. Does it, though?" }
  }
}
